id_name,comment_text,user_id_link,rating
萨罗迈拉,好羡慕创作参与这部电影的所有人。羡慕邵艺辉，可以用影像记录最当下的议题和思考，把“正发生”变成一段抹不掉的记忆；羡慕宋佳，在最好的年纪塑造了这么有力量的女性角色，“职场女性”和“单亲妈妈”的形象多了一种可能性（而且穿衬衫西装怎么那么帅啊！！）；羡慕小女孩，那么小就可以知道并亲口说出那些我花了好多年才自洽和解的女性羞耻；羡慕男演员们，理由就不说了。当然还羡慕宋佳可以rua钟楚曦的狗狗头，羡慕钟楚曦可以贴贴穿西装的宋佳！（再补充一个刚看到的小细节，铁梅、小叶、茉莉，女孩的名字都是蓬勃生长的绿色植物！）,https://www.douban.com/people/57634132/,力荐
Lucas,真正读过铁梅全部文章的只有小茉莉。,https://www.douban.com/people/54342192/,力荐
momo,那段母亲手里的声音孕育了整个世界的转场够我跪着看了,https://www.douban.com/people/188569354/,力荐
Hcaep,小孩儿猜声音那点太妙了，几个简单的镜头就把铁梅日常的艰辛、琐碎全都表现出来了。,https://www.douban.com/people/Peach.T/,力荐
人民艺术家,让我们坦率一点儿吧。这真的有必要拍成电影吗？让大家来电影院看快节奏大荧幕版本的电视剧？电视剧级别的调度和节奏，电视剧级别的场景构建，电视剧级别的小资故事，电视剧级别的人物。尤其是把小孩儿推出来，让她拥有30岁独立女性的一针见血与八岁小孩的软弱自卑。这样表达女性主义，是否有点太鸡贼了？,https://www.douban.com/people/203854855/,较差
快乐的大傻子,一些女拳的意淫，猎奇的微博评论式靠丑化/扁平化男性搞男女对立言论博眼球赚红利，麻木女性观众，闭门造车，让女性自娱自乐，降智，煎熬,https://www.douban.com/people/14063551/,很差
Онисог,戴老师说过：“电影这艘大船要沉了，所以男性纷纷弃船而逃，而女性就像在面对任何灾难时刻一样挺身而出去接替他们。”现在，她们甚至做的更好！就像是《自由引导人民》中象征自由的女神一样，带领着电影走向未来！过往的男性叙事中，我们要么蛇蝎，要么悲情…事实呢？是不管发生什么，我们总有办法！无论是《好东西》还是《山花烂漫时》，女性叙事从来都不是展示苦难，咀嚼困难的，因为我们足够自信乐观，才能直面悲剧！有人说导演是中国的Woody Allen，就像我挺爱这个掉书袋子的老头儿一样，同样喜欢导演。不然呢？要去喜欢将那些网络热梗并入电影叙事中，并开创“抖音电影”这一新的电影类型的某些男导吗？用拟音表达具象的母爱，太聪明了！女性的爱是“藏”，男性的爱是“显”，就像小孩问他爸：“你这样对我难道不是应该的吗？”灵的嘞！,https://www.douban.com/people/183308493/,力荐
张小北,轻松+愉快，自信+睿智，优秀的女性电影和城市电影（而不是什么生套概念的“小妞电影”），比导演优秀首作《爱情神话》更好的第二部电影。（不是发生在城市里的故事就是城市电影，工业文明基础上的城市文化足够成熟后，才会诞生这种社会议题+流行文化+电影艺术的结合。很多那种以城市为背景的电影讲述的还是农业时代的故事和人。）,https://www.douban.com/people/xzfd/,力荐
阿德,值得一个国产片年度十佳,https://www.douban.com/people/joearde/,力荐
murmur,邵导了不起！ 看完《好东西》，和朋友感慨：邵艺辉真正找到了自己的声音。这个声音是都市的年轻的，锋利但轻快的，也是女性的自信的。这些形容词每个都不简单，但邵艺辉（看起来）很轻松地全部做到了。哦，还有幽默，让全影院不同年龄哈哈大笑的幽默。 写一个好故事很难，更难的是用自己的语气和声调写一个好故事。 电影散场，走进上海的秋夜，空气有点凉，很快乐、也受到鼓励。希望邵导一直一直拍下去！,https://www.douban.com/people/2285992/,力荐
我不叫复活节,看着周遭一片好评面面相觑：难道我脱离群众了？ 我的真实观感：情节破碎人物虚浮，融了一堆热门议题的女权主义党建片😑没有任何反对女性主义的意思，但确实也感受到了女性主义在国内的发展现状：太多表达，太多口号，太少落地。 本片唯一亮点：听母亲做的家务声音猜音效。（但再好的瑶柱也没法给不好的菜吊味呀……）,https://www.douban.com/people/64090808/,较差
栗,那段采集音频的蒙太奇也太好了，一个小孩关于整个宽阔世界的想象是如何塌缩成一个女性在家中方寸之间的劳作，但是这个女性又是如何螺丝道场用骨肉铸成爱意将自己的天赋传递给自己的小孩，好像在生命的广度变成了一种由时间带来的深度。,https://www.douban.com/people/Ashleybiubiu/,力荐
小开心,满电影院都是女性的笑声。,https://www.douban.com/people/2488427/,力荐
Jane,我正直勇敢有阅读量，就喜欢这样的电影,https://www.douban.com/people/lwjane/,力荐
hfjdnnd,这部电影或许就是女权表演艺术家本身,https://www.douban.com/people/lakobe24/,还行
咖,女儿听录音那场戏是的全片最浪漫的情节。,https://www.douban.com/people/melaca/,力荐
凹凸,尖锐得如此轻盈，进步到有些魔幻。极其当下的性别和情感话题，无比真挚的女性情谊，这样的视角和议题置于大陆院线简直熠熠生辉。录音蒙太奇展示单亲妈妈日常的段落，宛如电影之神降临。节奏比起《爱情神话》松垮不少，但那又如何？谁规定必须把一切都做到最好呢？,https://www.douban.com/people/mr_tree/,力荐
野外的酒鬼,单纯不配，对其他高分电影的侮辱。,https://www.douban.com/people/chuwei123/,很差
西海岸有树,真的是好东西 最喜欢的一场戏是钟楚曦给小孩听录音让她猜是什么声音，日常生活里琐碎的煎蛋，吸尘，晾衣服，修地板，削面条，在小孩那里成了龙卷风，暴雨，泥石流，岩浆……听起来是自然界最浩翰的力量其实是一个女人独自稳住生活的点点滴滴💪 ps宋佳和钟楚曦真的好配演个真姬吧球球了,https://www.douban.com/people/westblue/,力荐
姜泥,“磕头的声音是不对的，用力打回去的声音才是正确的。”,https://www.douban.com/people/184893655/,力荐
微我无酒,小马说他把铁梅的每一篇文章都看过了，但事实上是茉莉看完并记住了铁梅写的所有东西。,https://www.douban.com/people/79627632/,力荐
木乐,这永远不会是中国的伍迪艾伦，也永远不会是中国的洪常秀，就凭那段饭桌上的戏，能有几个创作者能如此化用性别议题灵动地写出那么轻盈的喜剧台词？更别说那段音效试音与宋佳做家务的声画蒙太奇即便是在女性主义的创作者中都算是极富魅力的。 如果硬要说电影风格的源流，那《好东西》也应来自于上海文华的电影遗风，是张爱玲、是《太太万岁》，是一直以来土生土长的最中国、最民族化的海派喜剧。即便那些铺满的全片的独立音乐/西洋乐，那也是作为中国的现代化上海应有的、当下的真实。且撇掉那些关于男性女性性少数群体的议题，潜藏在文本骨子里的对权力、宏大叙事的那种讽刺劲，也比目前的大多中国电影有勇气有态度。 最后，大家好，我是邵艺辉的粉丝。,https://www.douban.com/people/131539529/,力荐
♂豆子,主动送上门约个炮就爱上第一次见面的野男人，还让他对你专一，要和他恋爱，知道他有很多炮友就吃药自杀；因为恋母看一眼就爱上老女人，结果她只想和你啪啪，不想让你走进她的生活，看个电影都不行；中年夫妻就得带环或者结扎，离了婚还纠缠不清随便来家里吃饭；与陌生人和小孩子大声讨论月经，一帮男的也一起讨论，还研究月经是不是蓝色的；小学生写个出游的作文就都得写出国经历，一句“你们那公立小学，不是所有人都出过国的”我以为这是日韩片呢；“优衣库事件”还是女的主动要求的，一句“男人很好玩的”还是对孩子说的……这又假又矫情又尬等等等等的玩意，就封为神作了？！真low，想吐🤮,https://www.douban.com/people/62875428/,很差
开水,全世界有一半的人都会流血，看过有一半的人都会打五星。,https://www.douban.com/people/46983241/,力荐
祝羽捷,那些频繁闪烁在女性主义理论里的术语化成了幽默感十足的生活褶皱，埋伏在都市情感生活中的性别问题浮出水面，一部极其女性友好的作品，每一个女性角色都生动可爱现代，她们没有雌竞，没有懦弱，没有对这个默认的游戏规则认领和继承。爆梗和埋伏让人捧腹大笑，比这更重要的是，女性觉醒的世界里处处是好东西。,https://www.douban.com/people/2245804/,力荐
刷鞋大王,一个因为缺爱每天都在发情的低智恋爱脑，一个魅力无限的玛丽苏，吸引着两个苦学男德、争当工具人的雄竞舔狗，通过大量密集的谈话把网上一些鸡汤段子杂糅到一起，对观众进行摁头式输出教育。铁梅在看演出时把孩子举到头顶挡住后面的人、在人口密集的居民楼里练打鼓，这都很“宝妈”，这些“为了孩子”的极端自私影响他人的不文明行为，跟被她呵斥的随地大小便的男人其实没有任何区别,https://www.douban.com/people/157380196/,很差
流浪小脂,“你的眼睛很美很亮，我喜欢你看我，你怎么看我都没事。”（特别喜欢小孩猜音效那段以及男同学使了牛劲要拽她鼓棒她却一动不动只是轻蔑地笑那段，非常自然勇敢又充满力量的女宝…）,https://www.douban.com/people/188273978/,力荐
同志亦凡人中文站,中青幼三代女性的经历充分说明，每个女性从小到大都会遇到无数个普信男。两个男的在餐桌上以雄竞方式比赛女性主义快把我笑疯了。宋佳好飒啊啊啊，霉霉是真顶流~~~~,https://www.douban.com/people/3540441/,推荐
苏韵锦还不起,只有茉莉才会把铁梅的所有报道都看完,https://www.douban.com/people/214415662/,力荐
12.,不刷抖音不看小红书的我也不觉得多新鲜 像是照着微博热搜一条条抠下来组成的段子合集 如果爱情神话的灵气值是100分 这一部可能刚及格且大多用在了声音蒙太奇那一段,https://www.douban.com/people/46364699/,还行
tlmgt,我看的这场，有妈妈带女儿一起来看的，散场出去时妈妈问女儿，好看吗？好不好看？……片中的女儿上台打鼓时，穿的衣服印的图案是 Taylor Swift 时代之旅演唱会的巡演海报，结尾又 cue 了一次时代之旅演唱会，这怎么不能算是一种时代性呢？看到有友邻觉得这是70分电影，我觉得不是，应该是85分电影。😊当然，打分没那么重要了。最喜欢的一句台词是小马引导王茉莉打鼓说的几句话：“你就把打鼓当成是一种发泄就可以了。你想啊，你不能随便打人，但是可以随便打鼓。”,https://www.douban.com/people/tlmgt/,力荐
问松林,小孩猜声音的那段看得我崩溃大哭，妈妈是泥石流是暴风雨是熊猫吃竹子的声音，邵艺辉你是天才，太感谢还有这么灵气又敏锐的年轻作者🥹🥹🥹这一部比起爱情神话更成熟、游刃有余了，希望以后还有多多的女性中心叙事，台词被人骂绕口或文绉绉又怎样呢，我们就是意有所指，因为我们过去有太多没能说。,https://www.douban.com/people/183174868/,力荐
无影,看完上舞蹈课一直想着章宇的胸肌没法集中注意力。。。男性角色全员工具人原来这么爽的吗（原来男的一直都吃这么好的啊。。。小女孩听录音和餐桌上的雄竟两场简直了。。。,https://www.douban.com/people/wingxin1/,力荐
Agoraphobia,《好东西》就像上了一桌琳琅满目的菜，什么都想讨论，建构了一块很漂浮的女性岛屿，充满口号式的喧哗，但其实因为过于拥挤的符号而留不下什么真实的触碰。导演本身是温和的人，所以她在电影中设想了美好的情境，独立的单亲妈妈，开放的恋爱关系，单女互助带娃，甚至还有和三个男性谈论月经的桥段。但这些想象都太贫瘠，既没让人真正爽到，又完全不落地，解决不了真实的问题甚至让人都意识不到问题的核心。这部在很多地方都没有《出走的决心》带给我的震撼大，不是鼓励抒写女性苦难，而是它预设了一个男性都学习过性别议题的世界（且不讨论这个世界有多漂浮），但现实是远远落后很多步的。,https://www.douban.com/people/correspondent17/,还行
Mr. Infamous,很好，内地也有自己的《芭比》。也不需要额外幻想，反正我们就处在一个想都不敢想的结构性困境里。性别、性向（加上背景里真有gay）、教育理念、反成功学、自我人格、性自由、新闻理想……这么多理应表达而容易折戟的命题，被她这么精巧而诙谐地尽数刺穿，真了不起。得兼备勇气和才情，才能让一众角色，尤其是女性角色，有发自内心的酷，毕竟这种酷意味着跟寻常规矩，跟大多数盲从选择之间警惕地留有距离。也因此，要说电影哪里不对的话，是小孩何止是上海最幸福的小孩。而且，太喜欢她的灵光频现了，尤其是音效盲听，饭桌斗嘴，妙极。稍嫌两位女主有时争吵得太伤对方，毕竟以铁梅的情商，小叶的性情，这样许是不够服帖。瑕不掩瑜，演员和角色能在这么好的本子里相互成就，实属幸福。还是希望更多这样的好作品，多表达，多暴露，作为男性，非常爱看。,https://www.douban.com/people/misterinfamous/,力荐
东,讨论了特别多的女性议题，月经羞耻、家务分工、来自母亲的否定、女强思想、单母家庭、男凝反思、性别气质等等等，但惊奇于议题之下的生活细节完全缺失。议题的狂欢背后是假大空的粗糙。,https://www.douban.com/people/liuadong/,还行
Gintoki,全是金句不是电影,https://www.douban.com/people/214958605/,还行
神仙鱼,很久没看国产喜剧边笑边哭了，且不是硬煽（除偶有几处音乐稍多），桥段用梗台词表演都自然松弛，没有感到刻意做作，在当下中国电影市场简直奇迹。 和同期在映那部片相比，这才是“女人世界”，直面Her Story中的苦痛。再加上多处YQ指涉（王铁梅/囤货/明天会更好/垃圾墙标语）、光明正大谈性和展示LGBT元素、直接表达对男性/男权/男性女权表演艺术的讽刺或抨击，RESPECT 喜欢也敬佩结尾借小孩之口说出的那段“直面悲剧”，不知这一代能否做到，或许哪一代能做到TA们才能真正期待更好的明天（看评论发现“明天会更好”这句没唱出来），否则对布景上写的“这个世界还会好吗”只能抱持悲观答案。 二刷完想说，正直勇敢有阅读量的人，你们永远都不可怜。 （https://www.douban.com/people/eric_iiw/status/4775293616）,https://www.douban.com/people/eric_iiw/,推荐
杨迪,电影已经看完一阵子了，一直没来评分。前几天和几个看过的朋友讨论来着，有人很喜欢，有人很反感，我是前者。我现在看一部作品，不太去评价角色和情节是否有过多虚构成分，我都是接受片子构建的世界，再当个观察者就好。（事实上片子里几乎所有内容都是真实存在于上海）看罢电影，已住上海十年的我更喜欢上海了，片里有的讽刺，我知道那不是我，片里有的鼓舞，切实帮助了我，就够了。,https://www.douban.com/people/tieliuwudi/,力荐
我哪敢说话,磕头的声音不对，反击的声音才对，这是一部值得反复细品的好电影。,https://www.douban.com/people/175642318/,力荐
琼斯黄,感觉每个人物都是在评论区发言，彼此“回复”。,https://www.douban.com/people/lengleng/,还行
Virgil,点映。不满意主要两点：塞太满了，再好的点子和台词也得讲求疏密有致；男性的设置过于悬空。其他都挺喜欢。尤其是我一直觉得爱情是人生最不重要的事情之一，所以很高兴能在电影院里听到主角也这样说。拿这个展望一下一对百合一对基就挺好😌顺便和我爸妈说了他们去看这部电影票找我报销。（那个胡医生长得很像某个认识的人我艹看得我一阵PTSD啊啊啊啊啊啊啊啊啊啊,https://www.douban.com/people/virgilzhou/,推荐
就是那颗紫薇星,看完《好东西》 感觉好难受 我真的没法接受一部电影讨论社会议题全靠台词输出。 感觉把左翼青年平时听的播客，发的微博，看的公众号拍成了抖机灵的集锦。 那几场精彩绝伦的饭桌戏，前后左右随便挪也不影响故事走向。 我能理解大家对于“女本位”叙事的渴望，但还是希望在大银幕上看到更多的《嘉年华》吧。😢 另外有一个感想是，无论是东方还是西方的电影产业，在所有的社会议题中，似乎只有性别议题被允许往喜剧的方向塑造。 我觉得这一方面是因为女性观众的极度包容，即“编导能看见我们，表达我们就很好”；另一方面是社会对严肃话题的一种规训：你可以讨论，但只能用轻松、不冒犯的方式。,https://www.douban.com/people/zsqbgd/,推荐
♬ CaR,1.想烫羊毛卷！2.那个洗衣房酒吧我去过的！3“正直勇敢有阅读量”所以不可怜！4.要活下去看新的游戏！5.刚好搬到新家的第二天看到这个电影，觉得一切又充满了希望！,https://www.douban.com/people/misscar/,力荐
树袋小熊,不是妈妈在煎蛋，晾衣服，洗蔬菜；是暴雨，龙卷风，泥石流。 不是琐碎的家务，是生活中的暴风雨。,https://www.douban.com/people/165730732/,力荐
石新雨,优点缺点都很明显，目前的电影市场亟需从生活中萃取幽默的能力，也亟需女性之间爽快的互助，无论小事大事，都催化出丰富的情感。 最可爱的是那些餐桌戏，无论是赵又廷对小叶、对小孩错位的关心，还是两个男的抛女性主义概念，还是小叶和铁梅的吐槽，餐桌上的每个人都能被注意，所以，这些滑稽的关注点，这些最通俗的性别观察，从各个方位上激活了空间。影片的精华也在这里，就像它前半段总是能在抛段子和好好说话之间找到平衡。而且，没有把茉莉和小叶对应成“长大后的自己”，她们各有各的妈妈，也同时拥有铁梅，这一点很聪明。 然而失控的是，后半段几乎全是小红书鸡汤般的拼凑，从说话的契机到片段的交织，搭建一个场景必然是为了引发共鸣，这种共鸣性文案（即使它总是说得不错）导致过度的反刍，取缔了时间的流动。,https://www.douban.com/people/226358861/,推荐
喜西西,观影体验远不如《爱情神话》，看到最后好累，被说教得疲惫。整部作品更像是主题明确的小品+脱口秀，戏剧冲突和人物对话的盘算感很强，来回两句话之间都没有气口，仿佛是早就准备好的答案。是啊，答案这不是显而易见嘛。不是没有灵气四溢的部分，饱受夸赞的声音试验一段确实非常喜欢。人们的确总是习惯于以自己的想象来得出结论，但这并不意味着自己的想象不好，或者另一种理解（也可以是事实）不好。毕竟铁梅也只是若干单亲妈妈生活状态的一种（想象）。但我不能接受把茉莉叫“小孩儿”，无论出于什么目的都不能接受。提前两周开始全国每天无数点映场，这跟提前上映没区别吧，原来新的游戏规则是这么玩的。问题重要当然很珍贵，就像确实是好东西，如果这是一篇檄文那没什么，但这是一部电影，所以我说不出违心的话。,https://www.douban.com/people/139562794/,还行
Morning,《爱情神话》拍了平面的三女性，这部拍了线性的三女性，将母女变成了流动的关系（而父子则是拉黑的关系），这里的妈妈也是急匆匆的，快下班时就着急要去接孩子，带孩子又急着去工作，生气起来也会骂小孩，但导演没有将这些破坏性的行为变成一种刻板的狗血矛盾，反而让人看见了一种爱的流动，女性之间的抚慰，是的她们依靠自己成长为强大的人，但因为同伴成长为美好的人，懦弱的、孤单的、不再幻想的，仍然是很好的人。专业的技巧并没有令电影变得更严肃沉重，“雄竞”、“结构性压迫”、真实的爱情欲望等被有趣的融入在剧本中，音效一场戏看得人泪眼婆娑。这是一部生动的电影，有一种细致的温柔，它不像有的电影充满着强劲有力的控制，它像酒，像新闻理想，像架子鼓，那种让人想要尝试、靠近和驾驭的欲望，欲望使得演员的表现更松弛，作品的氛围更纯粹。,https://www.douban.com/people/qiweiming750/,力荐
晓晓一,要正直勇敢阅读量，要很努力，但可以抽一根烟，可以吃一个饭团，可以搞砸，可以落泪，可以晚一点再去面对。感受到了女创作者隔空的拥抱和鼓励。影片开始没多久就被震撼，这么多年看了这么多电影，我竟是第一次看到妈妈把女儿扛在肩头看演出的画面。,https://www.douban.com/people/shaoyi/,力荐
草堂炊烟,我正直勇敢有阅读量，我有什么好可怜的。,https://www.douban.com/people/48915091/,力荐
mumudancing,今年最佳国产（爱情）喜剧！邵艺辉是中国的格蕾塔·葛韦格，创造自己的语法，重讲她的女性故事。但女性是活在真实的城市里的，街头巷尾，阁楼上下，和公共空间保持亲切的互动。在这些节奏轻快的互动里，男性、孩子、工作都只是一部分。她们的本质是自己，是用自己的感受去连接世界。——关于声音与听觉的部分太好了，关于孩子的写作太好了。笑到最后热泪盈眶，为新的电影鼓掌。,https://www.douban.com/people/mumudancing/,力荐
滕子京,题材好，新游戏规则好，也是好笑的，但不明白为什么每段中心思想都要用台词念出来。难道是为了防止被短视频低成本加工提炼，自己先把价值总结了？确实是颠覆范式。偶像剧的障碍总是生编硬造，它们不处理真实关系那一万种狗血（like再见爱人）。王铁梅如果没有读者骂，她其实没有遇到任何实质挫折，不需学区房和鸡娃，返回职场直接当领导，做饭修家电接孩子还能看演出，调剂生活的年下都给安排了。不就相当于单亲妈妈版的偶像剧？孩子兴趣班下面有那么多人欢呼，外挂开太大，可不得强行植入挫折？小孩上台一幕其实可以早结束。一定要拍完因为要引出金句：要暴露，被看见，哪怕有差评。跟单亲妈妈主题已经没有关系了，就差导演亲自上台万字创作谈。「正直勇敢有阅读量」之类都太刻意了。可能也没想拍一部五年后还能立住的电影，多埋爆点炸炸炸完事了。,https://www.douban.com/people/fengs/,还行
Troy,好东西不多，假东西不少,https://www.douban.com/people/83482941/,较差
1 min,上的什么桌 吃的什么饭...人在做天在看把女权当生意让人太难受了…,https://www.douban.com/people/244849116/,还行
牛肉蘑菇派,猜声音那段的表现手法真的太天才了我爆哭…,https://www.douban.com/people/hazukirimika/,力荐
江湖第一鼠霸主,难看。 卯足劲来讨好女人，却连脱性缘的意识都没有，结合性缘也没有探讨出更深的东西，最后的落脚点居然还是和性缘和谐共处。 你讨好的不是女权，是对“擦亮眼总能找到尊重女人的真爱”抱有坚定幻想的女大学生群体，是借卫生巾可以找我最后却和x先生步入婚姻殿堂的x小姐，是半醒不醒最好吃的约炮自由、服美役自由、生育自由的假女权真夫权大女主。两女主相拥而泣，上一秒在我们要自由，下一秒尿不湿奶粉团不团孩子吐奶怎么办。 满满的刻意，表面功夫粉妆玉砌，内核浮空不落地，出走半生却还在讨论女人缺不缺爱的命题。我呸，有谁在意结构性压迫下的所谓“爱”。不值一谈的命题说不出一二三请不要再上桌。 我看谁敢标榜这片子为女权，谁在浑水摸鱼上高度。女权，要的是权力，是成为新的“父”，而不是没屁用的“自由”。 没骨气的女权难有未来。,https://www.douban.com/people/211876568/,较差
★NEXT.7☆,“你以为你在解放女性思想，其实很多人压根不领你的情”主创们即使知道会这样，还是机关枪一样输出了两个小时，这份勇气和大爱就值得五颗星,https://www.douban.com/people/liyuanhui/,力荐
